{
  "$schema": "../lesson-dna-schema.json",
  "id": "medical-breakthroughs-conquering-disease",
  "version": "2.0.0",
  "title": "Medical Breakthroughs - Conquering Disease",
  "author": "UI-TARS Team",
  "createdAt": "2025-11-18T00:00:00.000Z",
  "updatedAt": "2025-11-18T00:00:00.000Z",
  "description": "Discover how medical science transformed human health through vaccines, antibiotics, surgery, and modern medicine",
  "calendar": {
    "day": 19,
    "date": "January 19, 2025",
    "month": "January"
  },
  "category": "science",
  "subcategory": "medicine",
  "difficulty": "beginner",
  "estimatedMinutes": 10,
  "prerequisites": [],
  "learningObjectives": [
    "Understand how vaccines and antibiotics revolutionized health",
    "Learn about major medical breakthroughs across history",
    "Explore how medical science works through research and testing",
    "Connect medical advances to increased lifespans and quality of life"
  ],
  "tags": [
    "medicine",
    "vaccines",
    "antibiotics",
    "surgery",
    "public-health",
    "disease",
    "healthcare",
    "medical-science"
  ],
  "ageVariants": {
    "2-5": {
      "title": "Doctors Help Us Stay Healthy!",
      "description": "Learn how doctors and medicine help keep people healthy and strong!",
      "language": {
        "en": {
          "title": "Doctors Help Us Stay Healthy!",
          "welcome": "Hi little friend! Have you ever visited a doctor when you were sick? Let's discover how doctors and medicine help us stay healthy!",
          "mainContent": "Doctors are special helpers who know a lot about how our bodies work. When you're sick or hurt, doctors figure out what's wrong and help you feel better. They went to school for many years to learn how to help people!\n\nMedicine is special stuff that helps your body fight sickness. Sometimes medicine is liquid you drink, sometimes it's pills you swallow, and sometimes it's shots. Medicine might not taste good, but it helps you get better! Different medicines help different kinds of sick.\n\nVaccines are special medicines that keep you from getting sick in the first place! You probably got some vaccines when you were a baby. Vaccines teach your body how to fight germs before you even get sick. It's like giving your body superpowers! Vaccines protect you from diseases that used to make many people very sick.\n\nDoctors use special tools to check if you're healthy. They use a stethoscope (that thing with earpieces and a round part) to listen to your heart and breathing. They use a thermometer to check your temperature. They shine lights in your eyes and ears. These tools help doctors see how your body is doing inside!\n\nHospitals are big buildings full of doctors and nurses who help people who are very sick or hurt. Hospitals have special equipment and medicine that helps people get better. If someone is too sick to take care of at home, they go to the hospital where doctors can watch them all the time.\n\nSurgery is when doctors need to fix something inside your body. They give you special medicine that makes you sleep so you don't feel anything. Then they can fix what's broken and sew you back up. Many people have had surgery and feel much better afterward!\n\nMedicine has gotten much better over time. Long ago, doctors didn't know as much as they do now. Today, doctors can help people with many diseases that used to be very dangerous. Scientists are always learning new ways to keep people healthy!\n\nYou can help yourself stay healthy too! Eating good food, exercising, sleeping enough, washing your hands, and visiting the doctor for check-ups all help keep you strong and healthy!",
          "keyPoints": [
            "Doctors learn how bodies work and help people feel better",
            "Medicine helps your body fight sickness",
            "Vaccines teach your body to fight germs before you get sick",
            "Doctors use special tools to check if you're healthy",
            "Eating well, exercising, and washing hands help you stay healthy"
          ],
          "interactionPrompts": [
            "Have you visited a doctor for a check-up?",
            "What helps you feel better when you're sick?"
          ],
          "wisdomMoment": "Doctors and medicine are like helpers for your body! They know how to help you stay healthy and feel better when you're sick. Taking care of yourself helps too!",
          "core_metaphor": "Doctors are like body mechanics - they know how to fix things that aren't working right",
          "abstract_concepts": {
            "medicine": "Special stuff that helps you get better",
            "vaccines": "Medicine that teaches your body to fight germs",
            "surgery": "When doctors fix something inside your body"
          },
          "cta": "Thank a doctor or nurse for helping people stay healthy!",
          "summary": "You've learned that doctors help people feel better, medicine helps fight sickness, vaccines teach your body to fight germs, doctors use special tools, hospitals help very sick people, surgery can fix things inside, and taking care of yourself keeps you healthy!"
        },
        "es": {
          "title": "¡Los doctores nos ayudan a mantenernos saludables!",
          "welcome": "¡Hola pequeño amigo! ¿Alguna vez has visitado a un doctor?",
          "mainContent": "Requiere traducción completa",
          "keyPoints": [
            "Los doctores aprenden cómo funcionan los cuerpos"
          ],
          "interactionPrompts": [
            "¿Has visitado a un doctor para un chequeo?",
            "¿Qué te ayuda a sentirte mejor cuando estás enfermo?"
          ],
          "wisdomMoment": "¡Maravilloso!",
          "core_metaphor": "Los doctores son como mecánicos del cuerpo",
          "abstract_concepts": {},
          "cta": "¡Sigue explorando!",
          "summary": "¡Gran aprendizaje hoy!"
        },
        "fr": {
          "title": "Les médecins nous aident à rester en bonne santé!",
          "welcome": "Salut petit ami! As-tu déjà visité un médecin?",
          "mainContent": "Nécessite traduction complète",
          "keyPoints": [
            "Les médecins apprennent comment fonctionnent les corps"
          ],
          "interactionPrompts": [
            "As-tu visité un médecin pour un examen?",
            "Qu'est-ce qui t'aide à te sentir mieux quand tu es malade?"
          ],
          "wisdomMoment": "Merveilleux!",
          "core_metaphor": "Les médecins sont comme des mécaniciens du corps",
          "abstract_concepts": {},
          "cta": "Continuez à explorer!",
          "summary": "Excellent apprentissage aujourd'hui!"
        }
      },
      "phases": [
        {
          "id": "welcome",
          "type": "welcome",
          "duration": 30,
          "content": "Doctors and medicine help us stay healthy!",
          "expressionCues": [
            {
              "timestamp": 0,
              "type": "micro-smile",
              "intensity": "moderate",
              "description": "Reassuring warmth"
            }
          ]
        },
        {
          "id": "teaching",
          "type": "teaching",
          "duration": 240,
          "content": "Medicine, vaccines, and doctors all help our bodies stay strong!",
          "teachingMoments": [
            {
              "concept": "medical_help",
              "explanation": "Medical science helps people get and stay healthy",
              "ageAppropriate": "Using familiar doctor visits"
            }
          ],
          "expressionCues": [
            {
              "timestamp": 10,
              "type": "macro-gesture",
              "intensity": "emphatic",
              "description": "Hands showing helping and healing"
            }
          ]
        },
        {
          "id": "practice",
          "type": "practice",
          "duration": 60,
          "content": "Have you visited a doctor for a check-up?",
          "expressionCues": [
            {
              "timestamp": 0,
              "type": "brow-raise",
              "intensity": "moderate",
              "description": "Encouraging sharing"
            }
          ]
        },
        {
          "id": "reflection",
          "type": "reflection",
          "duration": 45,
          "content": "Medicine helps people stay healthy and strong!",
          "expressionCues": [
            {
              "timestamp": 0,
              "type": "micro-smile",
              "intensity": "moderate",
              "description": "Grateful appreciation"
            }
          ]
        },
        {
          "id": "wisdom",
          "type": "wisdom",
          "duration": 30,
          "content": "Doctors are helpers for your body!",
          "expressionCues": [
            {
              "timestamp": 0,
              "type": "breath",
              "intensity": "subtle",
              "description": "Comforting reassurance"
            }
          ]
        }
      ],
      "pacing": {
        "speechRate": "slow",
        "pauseFrequency": "frequent",
        "interactionLevel": "high"
      },
      "vocabulary": {
        "complexity": "simple",
        "technical_terms": [
          "doctor",
          "medicine",
          "vaccine",
          "hospital",
          "surgery"
        ],
        "scaffolding": {
          "medicine": "Special stuff that helps you get better",
          "vaccine": "Medicine that protects you from getting sick",
          "surgery": "When doctors fix something inside"
        }
      },
      "tone": {
        "energy": "warm",
        "formality": "casual",
        "supportiveness": "highly-supportive"
      }
    },
    "6-12": {
      "title": "Medical Revolutions That Changed History",
      "description": "Explore major medical breakthroughs and their impact on human health",
      "language": {
        "en": {
          "title": "Medical Revolutions That Changed History",